<?xml version="1.0" encoding="UTF-8"?>
<xs:schema xmlns:xs="http://www.w3.org/2001/XMLSchema">
    <xs:element name="shop">
        <xs:complexType>
            <xs:sequence>
                <xs:element name="category" maxOccurs="unbounded" minOccurs="0">
                    <xs:complexType>
                        <xs:sequence>
                            <xs:element name="categoryName"/>
                            <xs:element name="subcategory" maxOccurs="unbounded" minOccurs="0">
                                <xs:complexType>
                                    <xs:sequence>
                                        <xs:element name="subcategoryName"/>
                                        <xs:element name="products">
                                            <xs:complexType>
                                                <xs:sequence>
                                                    <xs:element name="product" maxOccurs="unbounded" minOccurs="0">
                                                        <xs:complexType>
                                                            <xs:sequence>
                                                                <xs:element type="xs:string" name="producer"/>
                                                                <xs:element name="model">
                                                                    <xs:simpleType>
                                                                        <xs:restriction base="xs:string">
                                                                            <xs:pattern value="[a-zA-Z]{2}[0-9]{3}"/>
                                                                        </xs:restriction>
                                                                    </xs:simpleType>
                                                                </xs:element>
                                                                <xs:element name="productionDate">
                                                                    <xs:simpleType>
                                                                        <xs:restriction base="xs:string">
                                                                            <xs:pattern
                                                                                    value="(0[1-9]|[12][0-9]|3[01])-(0[1-9]|1[012])-\d{4}"/>
                                                                        </xs:restriction>
                                                                    </xs:simpleType>
                                                                </xs:element>
                                                                <xs:element type="xs:double" name="price"/>
                                                                <xs:element type="xs:int" name="quantity"/>
                                                            </xs:sequence>
                                                            <xs:attribute name ="color" type="xs:string"/>
                                                        </xs:complexType>
                                                    </xs:element>
                                                </xs:sequence>
                                            </xs:complexType>
                                        </xs:element>
                                    </xs:sequence>
                                </xs:complexType>
                            </xs:element>
                        </xs:sequence>
                    </xs:complexType>
                </xs:element>
            </xs:sequence>
        </xs:complexType>
    </xs:element>
</xs:schema>